{
  "schema": 2,
  "semester": "2026/2027-GANJIL",
  "updatedAt": "2026-09-13T19:30:00+07:00",
  "data": [
    {"code": "AB", "name": "Akhmad Bakhrun, S.Kom, M.T."},
    {"code": "AD", "name": "Dr. Ade Chandra Nugraha, S.Si., M.T."},
    {"code": "AE", "name": "Ardhian Ekawijana, S.T., M.T."},
    {"code": "AM", "name": "Asri Maspupah, S.S.T., M.T."},
    {"code": "AN", "name": "Ani Rahmani, S.Si., M.T."},
    {"code": "AP", "name": "Aprianti Nanda Sari, S.T., M.Kom."},
    {"code": "BN", "name": "Beri Noviansyah, S.Kom., M.T."},
    {"code": "BW", "name": "Bambang Wisnuadhi, S.Si., M.T."},
    {"code": "EB", "name": "Eddy B. Soewono, DRS., M.Kom."},
    {"code": "CF", "name": "Cholid Fauzi, S.T., M.T."},
    {"code": "CJ", "name": "Cahaya juniarti, M. Pd."},
    {"code": "DC", "name": "Djoko Cahyo Utomo L, S.Kom., M.MT."},
    {"code": "FI", "name": "Fitri Diani, S.Si., M.T."},
    {"code": "GI", "name": "Ghifari Munawar, S.T., M.T."},
    {"code": "HA", "name": "Ade Hodijah, S.Kom., M.T."},
    {"code": "HG", "name": "Hilman Gufron, M.Pd."},
    {"code": "HH", "name": "Hashri Hayati, S.T., M.T."},
    {"code": "IA", "name": "Dr. Iwan Awaludin, S.T., M.T."},
    {"code": "ID", "name": "Ida Suhartini, S.Kom., MMSI."},
    {"code": "IS", "name": "Irwan Setiawan, S.Si., M.T."},
    {"code": "IW", "name": "Irawan Thamrin, IR., M.T."},
    {"code": "JN", "name": "Jonner Hutahaean, BSET., M.Info.Sys."},
    {"code": "JO", "name": "Joe Lian Min, M.Eng."},
    {"code": "LH", "name": "Lukmannul Hakim Firdaus, S.Kom., M.T."},
    {"code": "MR", "name": "Muhammad Rizqi Sholahuddin, S.Si., M.T."},
    {"code": "MV", "name": "Maisevli Harika, S.ST., M.T., M.Eng"},
    {"code": "NJ", "name": "Dr. Nurjannah Syakrani, DRA., M.T."},
    {"code": "PH", "name": "Dr. Priyanto Hidayatullah, ST.,M.Sc."},
    {"code": "RA", "name": "Rahil Jumiyani, S.ST., M.Sc."},
    {"code": "RZ", "name": "Muhammad Riza Alifi, S.T., M.T."},
    {"code": "SD", "name": "Siti Dwi Setiarini, S.Si., M.T."},
    {"code": "SF", "name": "Sofy Fitriani, S.S.T., M.Kom"},
    {"code": "SN", "name": "Santi Sundari, S.Si., M.T."},
    {"code": "ST", "name": "Setiadi Rachmat, M.Eng."},
    {"code": "SW", "name": "Sri Ratna Wulan, S.Pd., M.T."},
    {"code": "TF", "name": "Tarekh Febriana Putra, M.Pd."},
    {"code": "TG", "name": "Trisna Gelar, S.T., M.Kom."},
    {"code": "TR", "name": "Dr. Transmissia Semiawan, BSCS., M.IT."},
    {"code": "WW", "name": "Wendi Wirasta, S.T., M.T."},
    {"code": "YA", "name": "Yadhi Aditya Permana, S.T. M.Kom"},
    {"code": "YD", "name": "Yudi Widhiyasana, S.Si., M.T."},
    {"code": "ZA", "name": "Zulkifli Arsyad, S.Kom., M.T."},
    {"code": "WAWAY", "name": "Waway Qodratullah S"},
    {"code": "FAZA", "name": "Faza Hannan Purinanda"},
    {"code": "TOPIK", "name": "Topik Mulyana"},
    {"code": "YZD", "name": "YZD"},
    {"code": "LINDA", "name": "Linda"}
  ]
}
